{
  "$schema": "../../migration/schemas/lineage.schema.json",
  "schemaVersion": 1,
  "recordedAt": "2026-09-03",
  "v2Origin": {
    "repositoryPath": "C:/Android Studio Projects/ConundrumThomasV2",
    "branch": "main",
    "remote": null,
    "starterAudit": {
      "algorithm": "sha256(sorted LF-joined relative/path|bytes|sha256 records)",
      "excludedTrees": [".gradle", ".idea", "build", ".git"],
      "fileCount": 40,
      "byteCount": 114491,
      "digest": "eacbaa2ccdad22d8fa9ddf16cb946fccd4eb310899409d7ce6ce7753423d9aaa"
    },
    "rootCommit": "33e3b601cf9dc535436c6874168dcb138208e1ae",
    "rootTree": "d1cd0b15cbc78438dc44997be4e34aadcc3abc6e",
    "rootTag": "ct-v2-root-baseline"
  },
  "statusDefinitions": {
    "ACCEPTED_CANONICAL": "Explicit governing lineage accepted for its original V1 purpose.",
    "ACCEPTED_MILESTONE": "Explicitly accepted historical milestone.",
    "QUALIFIED_NOT_ACCEPTED": "Qualification evidence exists; Principal acceptance is not inferred.",
    "RESEARCH_REFERENCE": "Experimental evidence only; not a production or renderer admission.",
    "DIRTY_UNACCEPTED_EVIDENCE": "Uncommitted evidence identified only by observed fingerprints and never directly migratable."
  },
  "references": [
    {
      "id": "desktop-v1-oracle",
      "repositoryPath": "C:/Thomas/R003-AMD-Workspace",
      "requestedSpelling": "05283e82db26b1266dc1eef58309d4202aec302",
      "commit": "05283e82db26b1266dcb1eef58309d4202aec302",
      "tree": "a3b56bd67e78f2cdd1324b1e57a35411a0252b55",
      "status": "ACCEPTED_CANONICAL"
    },
    {
      "id": "ct-10-accepted",
      "repositoryPath": "C:/Thomas/R003-AMD-Workspace",
      "ref": "refs/tags/ct-10-accepted",
      "commit": "f695243ff0cebb24c803b89d9b0ade9f9efd8be8",
      "status": "ACCEPTED_MILESTONE"
    },
    {
      "id": "r010-r011-research",
      "repositoryPath": "C:/Thomas/R010-Mobile-Model-Lab",
      "commit": "d94278b6cf3853bab9b89b6b05db36f7002dd0be",
      "tree": "25e6a1f21aa27c9a86f95807e85e195961bca5b7",
      "status": "RESEARCH_REFERENCE"
    },
    {
      "id": "r009d-android",
      "repositoryPath": "C:/Android Studio Projects/Conundrum Thomas Android",
      "commit": "eb3efd8c318ef56d4cce9e2e12c9ffd4b973358d",
      "tree": "7f0f189e2fa8f83aa1964259a34600e020be836a",
      "status": "QUALIFIED_NOT_ACCEPTED"
    },
    {
      "id": "r009e-dirty-evidence",
      "repositoryPath": "C:/Android Studio Projects/Conundrum Thomas Android",
      "baseCommit": "eb3efd8c318ef56d4cce9e2e12c9ffd4b973358d",
      "commit": null,
      "status": "DIRTY_UNACCEPTED_EVIDENCE",
      "observedTrackedModifications": 8,
      "observedUntrackedFiles": 5,
      "observedInsertions": 695,
      "observedDeletions": 176,
      "trackedDiffGitBlobSha1": "4c1cbc92d7fb6d01bd18bbcceaa9db57d82f8ace",
      "untrackedSha256": {
        "app/src/androidTest/java/com/conundrum/thomas/ui/ThomasConversationControllerInstrumentedTest.kt": "ba2a7aa00bb9c2a30f50905ccb814d4a8a50821185d21e4ef0138b1e6a4e6d09",
        "app/src/main/java/com/conundrum/thomas/speech/AndroidSpeechInputController.kt": "0ba691b1244a09b2c3d20a26524d928fcbdf9182ab54d8b1c65fed9714e80b31",
        "app/src/main/java/com/conundrum/thomas/speech/SpeechInputContracts.kt": "ab34bdd9c28086fa734ac95de9ca180e8ce41a7b44baca6f75dbf0c38b302ad6",
        "app/src/test/java/com/conundrum/thomas/speech/SpeechInputSessionTest.kt": "30fc8ac16a4f4bf34ef1b38399f2dd5bf8e2bb2d41f274e1d94f0dbd326bac93",
        "docs/CT-R009E-QUALIFICATION.md": "3cb61224224c3aa2bc3e7a7d2f1a74fd2685af0528690088687c5ddf07addf7e"
      }
    }
  ],
  "modelDisposition": {
    "families": ["R007", "R008", "R010", "R011", "other V1 model artifacts"],
    "status": "RESEARCH_REFERENCE",
    "admittedAsV2Renderer": false,
    "futureAdmissionRequires": [
      "renderer-specific instruction-fidelity qualification",
      "forbidden-act and unsupported-addition qualification",
      "therapeutic-policy-leakage qualification",
      "target-hardware qualification",
      "explicit approval"
    ]
  }
}
